bic,bic_denominacion,eswiki_titulo,eswiki_url,id_bic,id_bic_canarias
http://www.wikidata.org/entity/Q1024943,iglesia de la Concepción,Parroquia Matriz de Nuestra Señora de la Concepción (San Cristóbal de La Laguna),https://es.wikipedia.org/wiki/Parroquia_Matriz_de_Nuestra_Se%C3%B1ora_de_la_Concepci%C3%B3n_(San_Crist%C3%B3bal_de_La_Laguna),RI-51-0001212,
http://www.wikidata.org/entity/Q1049248,Castillo de Guanapay,Castillo de Santa Bárbara (Teguise),https://es.wikipedia.org/wiki/Castillo_de_Santa_B%C3%A1rbara_(Teguise),RI-51-0008266,
http://www.wikidata.org/entity/Q1049274,Castillo de la Luz,Castillo de la Luz,https://es.wikipedia.org/wiki/Castillo_de_la_Luz,RI-51-0001107,
http://www.wikidata.org/entity/Q11073552,Parroquia San Francisco de Asís,Parroquia de San Francisco de Asís (Las Palmas de Gran Canaria),https://es.wikipedia.org/wiki/Parroquia_de_San_Francisco_de_As%C3%ADs_(Las_Palmas_de_Gran_Canaria),RI-51-0008709,
http://www.wikidata.org/entity/Q1241319,Real Santuario Insular de Nuestra Señora de las Nieves,Real Santuario Insular de Nuestra Señora de las Nieves,https://es.wikipedia.org/wiki/Real_Santuario_Insular_de_Nuestra_Se%C3%B1ora_de_las_Nieves,,
http://www.wikidata.org/entity/Q1276162,Exconvento de San Agustín,Exconvento de San Agustín (Tacoronte),https://es.wikipedia.org/wiki/Exconvento_de_San_Agust%C3%ADn_(Tacoronte),ARI-51-0009032,259
http://www.wikidata.org/entity/Q129389,Barrio de los Hoteles,Los Hoteles (Santa Cruz de Tenerife),https://es.wikipedia.org/wiki/Los_Hoteles_(Santa_Cruz_de_Tenerife),RI-53-0000394,1118
http://www.wikidata.org/entity/Q1385934,Catedral de Canarias,Catedral de Canarias,https://es.wikipedia.org/wiki/Catedral_de_Canarias,RI-51-0003939,
http://www.wikidata.org/entity/Q1435665,Salinas de Arinaga,,,RI-51-0010673,
http://www.wikidata.org/entity/Q1451968,Museo de la Naturaleza y el Hombre,Museo de la Naturaleza y el Hombre,https://es.wikipedia.org/wiki/Museo_de_la_Naturaleza_y_el_Hombre,RI-51-0004989,351
http://www.wikidata.org/entity/Q1454573,Templo Masónico de Santa Cruz de Tenerife,Templo Masónico de Santa Cruz de Tenerife,https://es.wikipedia.org/wiki/Templo_Mas%C3%B3nico_de_Santa_Cruz_de_Tenerife,RI-51-0010945,1130
http://www.wikidata.org/entity/Q16540776,Camino del Socorro,Camino del Socorro (Güímar),https://es.wikipedia.org/wiki/Camino_del_Socorro_(G%C3%BC%C3%ADmar),RI-54-0000223,235
http://www.wikidata.org/entity/Q16544245,Casa del Paseo y Capilla de San Juan,Casa del Paseo y Capilla de San Juan,https://es.wikipedia.org/wiki/Casa_del_Paseo_y_Capilla_de_San_Juan,RI-54-0000140,
http://www.wikidata.org/entity/Q16544675,Castillo de El Cotillo,Castillo de El Cotillo,https://es.wikipedia.org/wiki/Castillo_de_El_Cotillo,RI-51-0008264,203
http://www.wikidata.org/entity/Q16563022,Ermita del Socorro,Ermita del Socorro (Güímar),https://es.wikipedia.org/wiki/Ermita_del_Socorro_(G%C3%BC%C3%ADmar),RI-51-0006936,236
http://www.wikidata.org/entity/Q1657172,iglesia de San Marcial de Rubicón,Ermita de San Marcial de Limoges (Femés),https://es.wikipedia.org/wiki/Ermita_de_San_Marcial_de_Limoges_(Fem%C3%A9s),RI-51-0008711,
http://www.wikidata.org/entity/Q16577826,iglesia de San Sebastián,Iglesia de San Sebastián (Agüimes),https://es.wikipedia.org/wiki/Iglesia_de_San_Sebasti%C3%A1n_(Ag%C3%BCimes),RI-51-0004478,
http://www.wikidata.org/entity/Q16577942,iglesia de Santo Domingo,Iglesia de Santo Domingo (Güímar),https://es.wikipedia.org/wiki/Iglesia_de_Santo_Domingo_(G%C3%BC%C3%ADmar),RI-51-0010946,
http://www.wikidata.org/entity/Q16587521,La Hidro,La Hidro,https://es.wikipedia.org/wiki/La_Hidro,RI-54-0000156,935
http://www.wikidata.org/entity/Q16592166,Llano de la Vírgen,Llano de la Virgen (Güímar),https://es.wikipedia.org/wiki/Llano_de_la_Virgen_(G%C3%BC%C3%ADmar),RI-54-0000181,937
http://www.wikidata.org/entity/Q16608527,Molino de la Menora,Molino de la Menora,https://es.wikipedia.org/wiki/Molino_de_la_Menora,RI-54-0000157,
http://www.wikidata.org/entity/Q16616473,Parroquia Matriz de San Pedro Apóstol,Iglesia de San Pedro Apóstol (Vilaflor),https://es.wikipedia.org/wiki/Iglesia_de_San_Pedro_Ap%C3%B3stol_(Vilaflor),RI-51-0008718,
http://www.wikidata.org/entity/Q16616473,Parroquia Matriz de San Pedro Apóstol,Iglesia de San Pedro Apóstol (Vilaflor),https://es.wikipedia.org/wiki/Iglesia_de_San_Pedro_Ap%C3%B3stol_(Vilaflor),RI-51-0008718-00000,
http://www.wikidata.org/entity/Q1700342,iglesia de Santa Catalina Mártir de Alejandría,Iglesia de Santa Catalina Mártir de Alejandría (Tacoronte),https://es.wikipedia.org/wiki/Iglesia_de_Santa_Catalina_M%C3%A1rtir_de_Alejandr%C3%ADa_(Tacoronte),RI-51-0008744,365
http://www.wikidata.org/entity/Q1707711,Ermita de los Dolores,Ermita de los Dolores (Tinajo),https://es.wikipedia.org/wiki/Ermita_de_los_Dolores_(Tinajo),RI-51-0010741,
http://www.wikidata.org/entity/Q1750856,iglesia de Nuestra Señora de la Peña de Francia,Iglesia de Nuestra Señora de la Peña de Francia (Puerto de la Cruz),https://es.wikipedia.org/wiki/Iglesia_de_Nuestra_Se%C3%B1ora_de_la_Pe%C3%B1a_de_Francia_(Puerto_de_la_Cruz),,250
http://www.wikidata.org/entity/Q17525464,Molinos y lavaderos de Chacaica,Molinos y lavaderos de Chacaica,https://es.wikipedia.org/wiki/Molinos_y_lavaderos_de_Chacaica,RI-53-0000529,
http://www.wikidata.org/entity/Q17612354,Casa-Museo Pérez Galdós,Casa-Museo Pérez Galdós,https://es.wikipedia.org/wiki/Casa-Museo_P%C3%A9rez_Gald%C3%B3s,RI-51-0008708,
http://www.wikidata.org/entity/Q18397857,El Casco,El Casco (Los Silos),https://es.wikipedia.org/wiki/El_Casco_(Los_Silos),RI-53-0000478,248
http://www.wikidata.org/entity/Q1878948,Castillo de San José,Castillo de San José,https://es.wikipedia.org/wiki/Castillo_de_San_Jos%C3%A9,RI-51-0008260,144
http://www.wikidata.org/entity/Q1952424,Convento de Santa Clara de Asís,Convento de Santa Clara de Asís (San Cristóbal de La Laguna),https://es.wikipedia.org/wiki/Convento_de_Santa_Clara_de_As%C3%ADs_(San_Crist%C3%B3bal_de_La_Laguna),RI-51-0004264,
http://www.wikidata.org/entity/Q20018152,San Juan de la Rambla,San Juan de la Rambla (casco),https://es.wikipedia.org/wiki/San_Juan_de_la_Rambla_(casco),RI-53-0000454,1057
http://www.wikidata.org/entity/Q2004326,iglesia de la Concepción,Iglesia de la Concepción (La Orotava),https://es.wikipedia.org/wiki/Iglesia_de_la_Concepci%C3%B3n_(La_Orotava),RI-51-0001211,
http://www.wikidata.org/entity/Q2053265,iglesia de San Francisco de Asís,Iglesia de San Francisco de Asís (Santa Cruz de Tenerife),https://es.wikipedia.org/wiki/Iglesia_de_San_Francisco_de_As%C3%ADs_(Santa_Cruz_de_Tenerife),RI-51-0008731,346
http://www.wikidata.org/entity/Q206404,Teatro Pérez Galdós,Teatro Pérez Galdós,https://es.wikipedia.org/wiki/Teatro_P%C3%A9rez_Gald%C3%B3s,RI-51-0006817,99
http://www.wikidata.org/entity/Q2073174,Castillo de San Cristóbal,Castillo de San Cristóbal (Santa Cruz de Tenerife),https://es.wikipedia.org/wiki/Castillo_de_San_Crist%C3%B3bal_(Santa_Cruz_de_Tenerife),,
http://www.wikidata.org/entity/Q2073408,Castillo de San Juan,Castillo de San Juan (Santa Cruz de Tenerife),https://es.wikipedia.org/wiki/Castillo_de_San_Juan_(Santa_Cruz_de_Tenerife),RI-51-0008257,360
http://www.wikidata.org/entity/Q20856286,Santuario de Nuestra Señora del Carmen,Santuario de Nuestra Señora del Carmen (Los Realejos),https://es.wikipedia.org/wiki/Santuario_de_Nuestra_Se%C3%B1ora_del_Carmen_(Los_Realejos),RI-51-0011164,
http://www.wikidata.org/entity/Q2185489,Faro de Punta Pechiguera,Faro de Punta Pechiguera,https://es.wikipedia.org/wiki/Faro_de_Punta_Pechiguera,RI-51-0010917,158
http://www.wikidata.org/entity/Q24568165,Cañada de los Gatos,Cañada de los Gatos,https://es.wikipedia.org/wiki/Ca%C3%B1ada_de_los_Gatos,RI-55-0000280,106
http://www.wikidata.org/entity/Q24693406,Las Cuevas de Don Gaspar,Cuevas de Don Gaspar,https://es.wikipedia.org/wiki/Cuevas_de_Don_Gaspar,RI-55-0000651,960
http://www.wikidata.org/entity/Q24951597,iglesia de Nuestra Señora de los Remedios,,,RI-51-0008733,
http://www.wikidata.org/entity/Q27616561,Sede del Parlamento de Canarias,Sede del Parlamento de Canarias,https://es.wikipedia.org/wiki/Sede_del_Parlamento_de_Canarias,RI-51-0011237-00000,349
http://www.wikidata.org/entity/Q27688767,Palacete Rodríguez Quegles,Palacete Rodríguez Quegles,https://es.wikipedia.org/wiki/Palacete_Rodr%C3%ADguez_Quegles,ARI-51-0007111,
http://www.wikidata.org/entity/Q28035250,Necrópolis de Maipés de Arriba,,,RI-55-0000081,
http://www.wikidata.org/entity/Q2878575,basílica de San Juan Bautista,Basílica de San Juan Bautista (Telde),https://es.wikipedia.org/wiki/Bas%C3%ADlica_de_San_Juan_Bautista_(Telde),RI-51-0007028,
http://www.wikidata.org/entity/Q2890339,Ermita de San Pedro y San Juan,Ermita de San Pedro y San Juan (Vallebrón),https://es.wikipedia.org/wiki/Ermita_de_San_Pedro_y_San_Juan_(Vallebr%C3%B3n),RI-51-0007418,
http://www.wikidata.org/entity/Q2890891,Parroquia de la Virgen del Pilar,Parroquia de la Virgen del Pilar (El Toscal),https://es.wikipedia.org/wiki/Parroquia_de_la_Virgen_del_Pilar_(El_Toscal),,
http://www.wikidata.org/entity/Q2918089,Capilla de San Pedro de Arriba,Capilla de San Pedro de Arriba,https://es.wikipedia.org/wiki/Capilla_de_San_Pedro_de_Arriba,RI-51-0010988,
http://www.wikidata.org/entity/Q2918942,Ermita de Nuestra Señora de La Concepción,Ermita de Nuestra Señora de La Concepción (Puerto del Rosario),https://es.wikipedia.org/wiki/Ermita_de_Nuestra_Se%C3%B1ora_de_La_Concepci%C3%B3n_(Puerto_del_Rosario),RI-51-0008717,
http://www.wikidata.org/entity/Q3198233,Castillo de San Miguel,Castillo de San Miguel (Garachico),https://es.wikipedia.org/wiki/Castillo_de_San_Miguel_(Garachico),RI-51-0008253,
http://www.wikidata.org/entity/Q3560239,El Museo Canario,El Museo Canario,https://es.wikipedia.org/wiki/El_Museo_Canario,RI-51-0001342,100
http://www.wikidata.org/entity/Q3565234,Museo Municipal de Bellas Artes de Santa Cruz de Tenerife,Museo municipal de Bellas Artes (Santa Cruz de Tenerife),https://es.wikipedia.org/wiki/Museo_municipal_de_Bellas_Artes_(Santa_Cruz_de_Tenerife),RI-51-0001343,354
http://www.wikidata.org/entity/Q3689605,Convento de Santa Catalina de Siena (San Cristóbal de La Laguna),Convento de Santa Catalina de Siena (San Cristóbal de La Laguna),https://es.wikipedia.org/wiki/Convento_de_Santa_Catalina_de_Siena_(San_Crist%C3%B3bal_de_La_Laguna),RI-51-0009020,
http://www.wikidata.org/entity/Q3699202,Museo y Parque Arqueológico Cueva Pintada,Museo y Parque Arqueológico Cueva Pintada,https://es.wikipedia.org/wiki/Museo_y_Parque_Arqueol%C3%B3gico_Cueva_Pintada,RI-51-0003880,
http://www.wikidata.org/entity/Q3739792,Faro de Maspalomas,Faro de Maspalomas,https://es.wikipedia.org/wiki/Faro_de_Maspalomas,RI-51-0006973,803
http://www.wikidata.org/entity/Q3821476,Vegueta,Vegueta,https://es.wikipedia.org/wiki/Vegueta,RI-53-0000155,89
http://www.wikidata.org/entity/Q43077814,Ermita de Nuestra Señora de la Merced,,,RI-51-0011457,
http://www.wikidata.org/entity/Q43078824,Institución de Villasegura,,,ARI-51-0007049,
http://www.wikidata.org/entity/Q43078876,Casa Miranda,,,ARI-51-0009037,997
http://www.wikidata.org/entity/Q43091014,Castillo de Santa Catalina,,,RI-51-0001239,
http://www.wikidata.org/entity/Q43091636,Museo de Bellas Artes,,,RI-51-0001341,
http://www.wikidata.org/entity/Q43111423,Grabados Rupestres del Barranco de Balos,Grabados rupestres del Barranco de Balos,https://es.wikipedia.org/wiki/Grabados_rupestres_del_Barranco_de_Balos,RI-51-0003912,73
http://www.wikidata.org/entity/Q43113884,Templo de San Francisco,,,RI-51-0004240,
http://www.wikidata.org/entity/Q43114526,Ermita de la Concepción,,,RI-51-0004350,112
http://www.wikidata.org/entity/Q43114744,Ermita de San Pedro González de Telmo,,,RI-51-0004382,
http://www.wikidata.org/entity/Q43114910,Iglesia de San José,,,RI-51-0004408,
http://www.wikidata.org/entity/Q43115365,Iglesia de San Pedro Mártir,,,RI-51-0004473,122
http://www.wikidata.org/entity/Q43115678,Casa de los Capitanes Generales,,,RI-51-0004535,
http://www.wikidata.org/entity/Q43117395,Antiguo Mercado,,,RI-51-0004828-00001,1126
http://www.wikidata.org/entity/Q43118063,Ex-convento de San Agustín,,,RI-51-0004925,
http://www.wikidata.org/entity/Q43118435,Cueva de Villaverde,,,RI-51-0004980,205
http://www.wikidata.org/entity/Q43120071,Molino de Corralejo,,,RI-51-0005287,
http://www.wikidata.org/entity/Q43120080,Molino de Villaverde,,,RI-51-0005288,
http://www.wikidata.org/entity/Q43120095,Molino de Tefía,,,RI-51-0005289,
http://www.wikidata.org/entity/Q43120105,Molino de los Llanos de la Concepción,,,RI-51-0005290,
http://www.wikidata.org/entity/Q43120118,Molino de Antigua,,,RI-51-0005291,
http://www.wikidata.org/entity/Q43120126,Molina de Valles de Ortega (Núcleo),,,RI-51-0005292,
http://www.wikidata.org/entity/Q43120135,Molino de Valles de Ortega,,,RI-51-0005293,
http://www.wikidata.org/entity/Q43120147,Molino de Valles de Ortega (Núcleo),,,RI-51-0005294,
http://www.wikidata.org/entity/Q43120156,Molino de Corralejo,,,RI-51-0005295,
http://www.wikidata.org/entity/Q43120167,Molino de El Roque,,,RI-51-0005296,
http://www.wikidata.org/entity/Q43120174,Molino de Lajares,,,RI-51-0005297,
http://www.wikidata.org/entity/Q43120184,Molino de Villaverde,,,RI-51-0005299,
http://www.wikidata.org/entity/Q43120194,Molina de Tindaya-Tebeto,,,RI-51-0005300,
http://www.wikidata.org/entity/Q43120206,Molina de la Asomada,,,RI-51-0005301,
http://www.wikidata.org/entity/Q43120211,Molina de Puerto Lajas,,,RI-51-0005302,
http://www.wikidata.org/entity/Q43120219,Molina de Almácigo,,,RI-51-0005303,
http://www.wikidata.org/entity/Q43120224,Molino de los Llanos de la Concepción,,,RI-51-0005305,
http://www.wikidata.org/entity/Q43120237,Molino del Durazno,,,RI-51-0005306,
http://www.wikidata.org/entity/Q43120244,Molino de la Corte,,,RI-51-0005307,
http://www.wikidata.org/entity/Q43120256,Molino de Tiscamanita,,,RI-51-0005308,
http://www.wikidata.org/entity/Q43120267,Molino de Tiscamanita,,,RI-51-0005309,
http://www.wikidata.org/entity/Q43120681,Casona de Fierro-Torres y Santa Cruz,,,RI-51-0005435,
http://www.wikidata.org/entity/Q43120694,Casona y Jardines de San Fernando,,,RI-51-0005436,
http://www.wikidata.org/entity/Q43120714,Casa de los Arroyo,,,RI-51-0005440,
http://www.wikidata.org/entity/Q43127913,Ermita de San Sebastián,,,RI-51-0006811,
http://www.wikidata.org/entity/Q43127922,Iglesia de Santo Domingo de Guzmán,,,RI-51-0006814,94
http://www.wikidata.org/entity/Q43128388,Pozo de la Virgen,,,RI-51-0006882,224
http://www.wikidata.org/entity/Q43128416,Casa de la Aguada,,,RI-51-0006885,
http://www.wikidata.org/entity/Q43129419,Ermita de Nuestra Señora del Socorro,,,RI-51-0007029,765
http://www.wikidata.org/entity/Q43129451,Ermita de San Vicente Ferrer,,,RI-51-0007031,
http://www.wikidata.org/entity/Q43129461,Ermita de San Pedro de Alcántara,,,RI-51-0007032,
http://www.wikidata.org/entity/Q43129477,Parroquia de Santa Ana,,,RI-51-0007033,
http://www.wikidata.org/entity/Q43129488,Ermita de San Isidro,,,RI-51-0007034,
http://www.wikidata.org/entity/Q43129497,Ermita de Nuestra Señora de Puerto Rico,,,RI-51-0007035,199
http://www.wikidata.org/entity/Q43129516,Ermita de San Roque,,,RI-51-0007037,
http://www.wikidata.org/entity/Q43129543,Escuela de Artes Aplicadas y Oficios Artísticos,,,RI-51-0007042,350
http://www.wikidata.org/entity/Q43129568,Edificio del antiguo Colegio de la Asunción,,,RI-51-0007048,
http://www.wikidata.org/entity/Q43130885,Casa del Capitán Quesada,,,RI-51-0007248,80
http://www.wikidata.org/entity/Q43130894,Ermita de San José de las Longueras,,,RI-51-0007249,
http://www.wikidata.org/entity/Q43132256,Palacio de Lercaro,,,RI-51-0007421,1030
http://www.wikidata.org/entity/Q43140505,Castillo de San Gabriel,Castillo de San Gabriel,https://es.wikipedia.org/wiki/Castillo_de_San_Gabriel,RI-51-0008259,
http://www.wikidata.org/entity/Q43140547,Castillo de Fustes,Castillo de Fuste,https://es.wikipedia.org/wiki/Castillo_de_Fuste,RI-51-0008265,
http://www.wikidata.org/entity/Q43140574,Castillo de San Marcial de Rubicón de Femes,Castillo de San Marcial de Rubicón de Femés,https://es.wikipedia.org/wiki/Castillo_de_San_Marcial_de_Rubic%C3%B3n_de_Fem%C3%A9s,RI-51-0008267,
http://www.wikidata.org/entity/Q43143513,Casa Natal de Benito Pérez Armas,,,RI-51-0008695,
http://www.wikidata.org/entity/Q43143573,Ermita de San José del Caidero,,,RI-51-0008710,79
http://www.wikidata.org/entity/Q43143593,Ermita de Nuestra Señora de Guadalupe,,,RI-51-0008712,183
http://www.wikidata.org/entity/Q43143605,Ermita de San Francisco,,,RI-51-0008713,
http://www.wikidata.org/entity/Q43143617,Ermita de Santo Domingo de Guzmán,,,RI-51-0008714,
http://www.wikidata.org/entity/Q43143640,Ermita de San Antonio,,,RI-51-0008716,
http://www.wikidata.org/entity/Q43143658,Iglesia de San Mauro Abad y Casa Parroquial,,,RI-51-0008720,171
http://www.wikidata.org/entity/Q43143662,Iglesia y Antiguo Convento Franciscano,,,RI-51-0008721,
http://www.wikidata.org/entity/Q43143676,Edificio Circulo de Amistad XII de Enero,,,RI-51-0008723,
http://www.wikidata.org/entity/Q43143688,Iglesia Parroquia de San Andrés,,,RI-51-0008725,
http://www.wikidata.org/entity/Q43143696,Ermita de Nuestra Señora del Buen Viaje,,,RI-51-0008726,
http://www.wikidata.org/entity/Q43143717,Ex-convento de San Francisco,,,RI-51-0008729,
http://www.wikidata.org/entity/Q43143757,Casa Fuerte,,,RI-51-0008734,219
http://www.wikidata.org/entity/Q43143761,"Ex Convento de San Sebastián, de las monjas de San Bernado",,,RI-51-0008735,249
http://www.wikidata.org/entity/Q43143764,Ermita de San Nicolás de Tolentino y Casa Solariega,,,RI-51-0008736,
http://www.wikidata.org/entity/Q43143772,Ex-convento de San Francisco,,,RI-51-0008737,
http://www.wikidata.org/entity/Q43143785,Iglesia de Santa Úrsula,,,RI-51-0008738,
http://www.wikidata.org/entity/Q43143810,Cueva de Belmaco,Parque Arqueológico de Belmaco,https://es.wikipedia.org/wiki/Parque_Arqueol%C3%B3gico_de_Belmaco,RI-51-0008740,
http://www.wikidata.org/entity/Q43143820,Casa Natal del Beato Padre Anchieta,,,RI-51-0008741,
http://www.wikidata.org/entity/Q43143832,Casa Natal de José Antonio de Viera y Clavijo,,,RI-51-0008742,247
http://www.wikidata.org/entity/Q43143843,Casa del Mayor Guerra,,,RI-51-0008743,
http://www.wikidata.org/entity/Q43145524,Hospital e Iglesia de Nuestra Señora de Los Dolores,,,RI-51-0009022,
http://www.wikidata.org/entity/Q43145531,Antiguo Convento de Santo Domingo,,,RI-51-0009024,1027
http://www.wikidata.org/entity/Q43154558,Fachada del Inmueble números 23 y 25 de la calle León y Castillo,,,RI-51-0010182,756
http://www.wikidata.org/entity/Q43156591,Primera sede del Cabildo de Lanzarote,,,RI-51-0010529,
http://www.wikidata.org/entity/Q43156716,"Inmuebles sitos en la calle Calvario, 52 y 54",,,RI-51-0010560,
http://www.wikidata.org/entity/Q43156830,Casa Mascareño,,,RI-51-0010602,1120
http://www.wikidata.org/entity/Q43156984,Salinas del Carmen,,,RI-51-0010642,
http://www.wikidata.org/entity/Q43157097,Salinas de Tenefé,,,RI-51-0010674,
http://www.wikidata.org/entity/Q43158321,La Financiera,,,RI-51-0010987,
http://www.wikidata.org/entity/Q43158346,Ermita de San Isidro Labrador,,,RI-51-0010997,
http://www.wikidata.org/entity/Q43158663,Ermita de San José,,,RI-51-0011071,
http://www.wikidata.org/entity/Q43158676,Ermita de San Marcos,,,RI-51-0011094,771
http://www.wikidata.org/entity/Q43158943,Polvorín de Taco,,,RI-51-0011163,1029
http://www.wikidata.org/entity/Q43158953,Casa del Capitán,,,RI-51-0011165,1139
http://www.wikidata.org/entity/Q43160845,Ermita de Nuestra Señora de los Dolores y San Miguel Arcángel,,,RI-51-0011509,
http://www.wikidata.org/entity/Q43165664,Cementerio de Vegueta,,,RI-51-0012206,
http://www.wikidata.org/entity/Q43165676,Cementerio Inglés,,,RI-51-0012207,
http://www.wikidata.org/entity/Q43168681,Casco antiguo de la ciudad de de Santa Cruz de la Palma,,,RI-53-0000187,
http://www.wikidata.org/entity/Q43168901,Villa de La Orotava,,,RI-53-0000210,240
http://www.wikidata.org/entity/Q43168914,Conjunto Histórico Artístico Casco Antiguo de la Ciudad de Arucas,,,RI-53-0000211,
http://www.wikidata.org/entity/Q43169094,Conjunto histórico artístico de Teror,,,RI-53-0000225,
http://www.wikidata.org/entity/Q43169120,"Castillo de San Gabriel, Camino y Puente",,,RI-53-0000227,
http://www.wikidata.org/entity/Q43169246,La ciudad de Tacoronte,,,RI-53-0000238,
http://www.wikidata.org/entity/Q43169288,Conjunto Histórico Artístico Barrios de San Juan y San Francisco,,,RI-53-0000241,
http://www.wikidata.org/entity/Q43169297,Conjunto Histórico Artístico la Plaza de Santiago,,,RI-53-0000242,75
http://www.wikidata.org/entity/Q43169528,Conjunto Histórico Artístico Casco Antiguo de la Ciudad de Santa María de Guía,,,RI-53-0000263,
http://www.wikidata.org/entity/Q43170209,Barranco Hondo de Abajo,,,RI-53-0000378,76
http://www.wikidata.org/entity/Q43170369,Conjunto Histórico Artístico El Caserío de Icor,,,RI-53-0000412,
http://www.wikidata.org/entity/Q43170376,El Caserío de Masca,,,RI-53-0000413,
http://www.wikidata.org/entity/Q43170534,Casas de la Mayordomía y Ermita de San Antonio Abad,,,RI-53-0000443,
http://www.wikidata.org/entity/Q43170565,Buenavista del Norte,,,RI-53-0000452,906
http://www.wikidata.org/entity/Q43170577,Villa y Puerto de Garachico,,,RI-53-0000453,229
http://www.wikidata.org/entity/Q43170656,Casco histórico de San Cristóbal de la Laguna,,,RI-53-0000466,
http://www.wikidata.org/entity/Q43170722,Icod de los Vinos,,,RI-53-0000476,955
http://www.wikidata.org/entity/Q43171397,El Casco Histórico de Gúimar,,,RI-53-0000516,
http://www.wikidata.org/entity/Q43171481,Casco Histórico de Santa Brígida,,,RI-53-0000530,804
http://www.wikidata.org/entity/Q43171559,Molino de los Barber,,,RI-53-0000539,
http://www.wikidata.org/entity/Q43171574,Caserío de Casas Altas,,,RI-53-0000541,
http://www.wikidata.org/entity/Q43171574,Caserío de Casas Altas,,,RI-53-0000541,
http://www.wikidata.org/entity/Q43171583,El Molino y Lavaderos,,,RI-53-0000542,
http://www.wikidata.org/entity/Q43172060,Guía de Isora,,,RI-53-0000583,934
http://www.wikidata.org/entity/Q43172123,El Realejo Bajo,,,RI-53-0000591,
http://www.wikidata.org/entity/Q43172186,El Antiguo Santa Cruz,,,RI-53-0000607,
http://www.wikidata.org/entity/Q43172315,"Iglesia de Nuestra Señora de La Luz, Arico el Nuevo",,,RI-53-0000621,
http://www.wikidata.org/entity/Q43173042,El Patio de los Siete Lagares,,,RI-54-0000058,
http://www.wikidata.org/entity/Q43173184,"Conjunto de Muelles, Almacenes, Varaderos y Puente del Barranco y Playa de Valleseco",,,RI-54-0000079,1132
http://www.wikidata.org/entity/Q43173288,Sima de Jinámar,,,RI-54-0000092,125
http://www.wikidata.org/entity/Q43173831,Sitio Histórico de Nuestra Señora de Buen Paso,,,RI-54-0000142,
http://www.wikidata.org/entity/Q43173847,Lo de Ramos,,,RI-54-0000144,
http://www.wikidata.org/entity/Q43173903,Finca los Dolores,,,RI-54-0000149,
http://www.wikidata.org/entity/Q43173945,Barrio de los Quevedos,,,RI-54-0000158,
http://www.wikidata.org/entity/Q43174079,La Librea de Valle Guerra,,,RI-54-0000169,
http://www.wikidata.org/entity/Q43174098,La Librea de Tegueste,,,RI-54-0000170,1135
http://www.wikidata.org/entity/Q43174112,Molino de Agua,,,RI-54-0000171,
http://www.wikidata.org/entity/Q43174123,Molino Quemado,,,RI-54-0000172,
http://www.wikidata.org/entity/Q43174159,Acueducto de los Molinos,,,RI-54-0000178,966
http://www.wikidata.org/entity/Q43174197,Camino de El Ciprés,,,RI-54-0000182,
http://www.wikidata.org/entity/Q43174312,Camino de Candelaria,Camino viejo de Candelaria (Santa Cruz de Tenerife),https://es.wikipedia.org/wiki/Camino_viejo_de_Candelaria_(Santa_Cruz_de_Tenerife),RI-54-0000195,910
http://www.wikidata.org/entity/Q43174312,Camino de Candelaria,Camino viejo de Candelaria (Santa Cruz de Tenerife),https://es.wikipedia.org/wiki/Camino_viejo_de_Candelaria_(Santa_Cruz_de_Tenerife),RI-54-0000195,910
http://www.wikidata.org/entity/Q43174312,Camino de Candelaria,Camino viejo de Candelaria (Santa Cruz de Tenerife),https://es.wikipedia.org/wiki/Camino_viejo_de_Candelaria_(Santa_Cruz_de_Tenerife),RI-54-0000195,910
http://www.wikidata.org/entity/Q43174319,Alfombras del Corpus,,,RI-54-0000206,692
http://www.wikidata.org/entity/Q43174341,Casa de Fray Andresito,,,RI-54-0000209,
http://www.wikidata.org/entity/Q43174366,El Charco de la Aldea,,,RI-54-0000214,
http://www.wikidata.org/entity/Q43174381,Danza del Diablo,,,RI-54-0000215,
http://www.wikidata.org/entity/Q43174469,Pozos de los desaparecidos en la Guerra Civil Española,,,RI-54-0000226,
http://www.wikidata.org/entity/Q43174594,Sitio Etnológico del Secadero de Tabaco,,,RI-54-0000630,
http://www.wikidata.org/entity/Q43174605,Molino de aceite de el Valle,,,RI-54-0010555,
http://www.wikidata.org/entity/Q43175282,"La Guancha, El Agujero y Bocabarranco",,,RI-55-0000067,87
http://www.wikidata.org/entity/Q43175453,Yacimiento Arqueológico de Zonzamas con queseras y construcciones ciclópeas,,,RI-55-0000094,
http://www.wikidata.org/entity/Q43175541,Yacimiento Arqueológico de Botija,,,RI-55-0000103,83
http://www.wikidata.org/entity/Q43176155,Montaña de Las Huesas,,,RI-55-0000218,129
http://www.wikidata.org/entity/Q43176168,Zona Arqueológica de las Cuevas del Patronato o Facaracas,,,RI-55-0000219,
http://www.wikidata.org/entity/Q43176231,"Zona Arqueológica ""Lomo Galeón""",,,RI-55-0000224,
http://www.wikidata.org/entity/Q43176258,El Llanillo,,,RI-55-0000228,108
http://www.wikidata.org/entity/Q43176454,Zona Arqueológica El Entorno de la Cueva Pintada,,,RI-55-0000273,
http://www.wikidata.org/entity/Q43176520,Yacimiento arqueológico de La Restinga,,,RI-55-0000282,
http://www.wikidata.org/entity/Q43176550,Tagoror del Gallego,,,RI-55-0000298,119
http://www.wikidata.org/entity/Q43176948,Roque de Malpaso,,,RI-55-0000357,223
http://www.wikidata.org/entity/Q43177072,Cuevas de La Angostura,,,RI-55-0000382,
http://www.wikidata.org/entity/Q43177092,Zona Arqueológica la Cogolla de Venegueras,,,RI-55-0000387,
