bic,bic_denominacion,eswiki_titulo,eswiki_url,id_bic,id_bic_canarias
http://www.wikidata.org/entity/Q8342548,Castillo de San Francisco (Las Palmas de Gran Canaria),Castillo de San Francisco (Las Palmas de Gran Canaria),https://es.wikipedia.org/wiki/Castillo_de_San_Francisco_(Las_Palmas_de_Gran_Canaria),RI-51-0008262,
http://www.wikidata.org/entity/Q8352462,Cueva de Bencomo,Cueva de Bencomo,https://es.wikipedia.org/wiki/Cueva_de_Bencomo,RI-51-0008739,273
http://www.wikidata.org/entity/Q9006831,iglesia Matriz de Nuestra Señora de Guadalupe (Teguise),Iglesia Matriz de Nuestra Señora de Guadalupe (Teguise),https://es.wikipedia.org/wiki/Iglesia_Matriz_de_Nuestra_Se%C3%B1ora_de_Guadalupe_(Teguise),RI-51-0004342,148
http://www.wikidata.org/entity/Q9082133,Teatro Chico,Teatro Chico (Santa Cruz de La Palma),https://es.wikipedia.org/wiki/Teatro_Chico_(Santa_Cruz_de_La_Palma),RI-51-0008690,180
http://www.wikidata.org/entity/Q9089023,Torre del Conde (España),Torre del Conde (Canarias),https://es.wikipedia.org/wiki/Torre_del_Conde_(Canarias),RI-51-0006884,
http://www.wikidata.org/entity/Q34485,basílica de Nuestra Señora de la Candelaria,Basílica de Nuestra Señora de la Candelaria,https://es.wikipedia.org/wiki/Bas%C3%ADlica_de_Nuestra_Se%C3%B1ora_de_la_Candelaria,RI-51-0007410,
http://www.wikidata.org/entity/Q34562,Catedral de San Cristóbal de La Laguna,Catedral de San Cristóbal de La Laguna,https://es.wikipedia.org/wiki/Catedral_de_San_Crist%C3%B3bal_de_La_Laguna,RI-51-0004949,
http://www.wikidata.org/entity/Q63368,Real Santuario del Cristo de La Laguna,Real Santuario del Santísimo Cristo de La Laguna,https://es.wikipedia.org/wiki/Real_Santuario_del_Sant%C3%ADsimo_Cristo_de_La_Laguna,,
